<?xml version="1.0" encoding="UTF-8"?>
<dataset xmlns:xsi="http://www.w3.org/2001/XMLSchema-instance"
          xsi:noNamespaceSchemaLocation="userSchema.xsd">

    <users id="1ae4ec9b-286d-4506-b915-b5b9527284e0"
           login="testOwner"
           password="$2a$12$bOPVAvWOC2f9gJoF37IeE.N9Ij15GfWeVlvHzDPTOJk66NimJMJ4."
           login_attempts="0"
           last_successful_login="2024-05-04 14:33:01.413581"
           last_failed_login="2024-05-04 14:33:01.413581"
           last_successful_login_ip="[NULL]"
           last_failed_login_ip="[NULL]"
           blocked="false"
           verified="true"
           language="EN"
           version="0"
           created_at="2024-05-04 14:33:01.413581"
           modified_at="2024-05-04 14:33:01.413581"
           created_by="[NULL]"
           modified_by="[NULL]"
           active="true"/>

    <users id="5af27f1c-5460-456f-877a-e73bc345e0b6"
           login="testOwner2"
           password="$2a$12$bOPVAvWOC2f9gJoF37IeE.N9Ij15GfWeVlvHzDPTOJk66NimJMJ4."
           login_attempts="0"
           last_successful_login="2024-05-04 14:33:01.413581"
           last_failed_login="2024-05-04 14:33:01.413581"
           last_successful_login_ip="[NULL]"
           last_failed_login_ip="[NULL]"
           blocked="false"
           verified="true"
           language="EN"
           version="0"
           created_at="2024-05-04 14:33:01.413581"
           modified_at="2024-05-04 14:33:01.413581"
           created_by="[NULL]"
           modified_by="[NULL]"
           active="true"/>

    <users id="7a5ea9fe-8cbc-4ccb-b9f7-243316bf0390"
           login="testTenant"
           password="$2a$12$bOPVAvWOC2f9gJoF37IeE.N9Ij15GfWeVlvHzDPTOJk66NimJMJ4."
           login_attempts="0"
           last_successful_login="2024-05-04 14:33:01.413581"
           last_failed_login="2024-05-04 14:33:01.413581"
           last_successful_login_ip="[NULL]"
           last_failed_login_ip="[NULL]"
           blocked="false"
           verified="true"
           language="EN"
           version="0"
           created_at="2024-05-04 14:33:01.413581"
           modified_at="2024-05-04 14:33:01.413581"
           created_by="[NULL]"
           modified_by="[NULL]"
           active="true"/>

    <!-- Token -->
    <tokens id="063612b8-57e2-4a73-bf8e-6cd7cc7c3b4a"
            token="20099995"
            purpose="OTP"
            user_id="1ae4ec9b-286d-4506-b915-b5b9527284e0"
            created_at="2024-05-04 14:33:01.413581"
            modified_at="2024-05-04 14:33:01.413581"
            expiration_date="2039-05-04 14:33:01.413581"
            version="0"
            created_by="[NULL]"
            modified_by="[NULL]"/>

    <tokens id="8ff10b31-72a4-434d-a96f-e7d9a269732e"
            token="30099990"
            purpose="OTP"
            user_id="5af27f1c-5460-456f-877a-e73bc345e0b6"
            created_at="2024-05-04 14:33:01.413581"
            modified_at="2024-05-04 14:33:01.413581"
            expiration_date="2039-05-04 14:33:01.413581"
            version="0"
            created_by="[NULL]"
            modified_by="[NULL]"/>

    <tokens id="422070b8-8e14-4cf4-8d58-9a01ea38738f"
            token="30099997"
            purpose="OTP"
            user_id="7a5ea9fe-8cbc-4ccb-b9f7-243316bf0390"
            created_at="2024-05-04 14:33:01.413581"
            modified_at="2024-05-04 14:33:01.413581"
            expiration_date="2039-05-04 14:33:01.413581"
            version="0"
            created_by="[NULL]"
            modified_by="[NULL]"/>

    <!-- Personal Data -->
    <personal_data user_id="1ae4ec9b-286d-4506-b915-b5b9527284e0"
                   email="testOwner@test.com"
                   temp_email="[NULL]"
                   first_name="test_first_name1"
                   last_name="test_last_name1"/>

    <personal_data user_id="5af27f1c-5460-456f-877a-e73bc345e0b6"
                   email="testOwner2@test.com"
                   temp_email="[NULL]"
                   first_name="test_first_name1"
                   last_name="test_last_name1"/>

    <personal_data user_id="7a5ea9fe-8cbc-4ccb-b9f7-243316bf0390"
                   email="testTenant@test.com"
                   temp_email="[NULL]"
                   first_name="test_first_name1"
                   last_name="test_last_name1"/>

    <!-- User 1 -->
    <access_levels active="true"
                   version="0"
                   id="d1130c9a-3bbb-4927-b79f-0fd521fa55ea"
                   user_id="1ae4ec9b-286d-4506-b915-b5b9527284e0"
                   level="OWNER"
                   created_at="2024-05-04 14:33:01.413581"
                   modified_at="2024-05-04 14:33:01.413581"
                   created_by="[NULL]"
                   modified_by="[NULL]"/>

    <access_levels active="true"
                   version="0"
                   id="537838a6-441e-41ad-ab29-4c2f779729d5"
                   user_id="5af27f1c-5460-456f-877a-e73bc345e0b6"
                   level="OWNER"
                   created_at="2024-05-04 14:33:01.413581"
                   modified_at="2024-05-04 14:33:01.413581"
                   created_by="[NULL]"
                   modified_by="[NULL]"/>

    <access_levels active="true"
                   version="0"
                   id="23aeee47-6b75-4de3-8313-5fccd3de841f"
                   user_id="7a5ea9fe-8cbc-4ccb-b9f7-243316bf0390"
                   level="TENANT"
                   created_at="2024-05-04 14:33:01.413581"
                   modified_at="2024-05-04 14:33:01.413581"
                   created_by="[NULL]"
                   modified_by="[NULL]"/>

    <owners id="d1130c9a-3bbb-4927-b79f-0fd521fa55ea"/>
    <owners id="537838a6-441e-41ad-ab29-4c2f779729d5"/>
    <tenants id="23aeee47-6b75-4de3-8313-5fccd3de841f"/>

</dataset>