<?xml version="1.0" encoding="UTF-8"?>
<dataset xmlns:xsi="http://www.w3.org/2001/XMLSchema-instance"
         xsi:noNamespaceSchemaLocation="userSchema.xsd">
    <!-- Administrator -->
    <users id="ba537227-d54f-42b3-aa58-10492cddf8a5"
           login="adminUser"
           password="$2a$12$bOPVAvWOC2f9gJoF37IeE.N9Ij15GfWeVlvHzDPTOJk66NimJMJ4."
           login_attempts="0"
           blocked="false"
           verified="true"
           language="EN"
           version="0"
           created_at="[NOW]"
           modified_at="[NOW]"
           active="true"/>

    <!-- Token -->
    <tokens id="6bcef94d-16f5-401b-a0d0-9461257572f9"
            token="20099984"
            purpose="OTP"
            user_id="ba537227-d54f-42b3-aa58-10492cddf8a5"
            created_at="2024-05-04 14:33:01.413581"
            modified_at="2024-05-04 14:33:01.413581"
            expiration_date="2039-05-04 14:33:01.413581"
            version="0"
            created_by="[NULL]"
            modified_by="[NULL]"/>

    <!-- Personal Data -->
    <personal_data user_id="ba537227-d54f-42b3-aa58-10492cddf8a5"
                   email="adminUser@test.com"
                   temp_email="[NULL]"
                   first_name="AdminUser"
                   last_name="AdminUser"/>

    <!-- Access Level -->
    <access_levels active="true"
                   version="0"
                   id="22f34716-3b77-4e63-809d-35f9a4758011"
                   user_id="ba537227-d54f-42b3-aa58-10492cddf8a5"
                   level="ADMINISTRATOR"
                   created_at="[NOW]"
                   modified_at="[NOW]"
                   created_by="[NULL]"
                   modified_by="[NULL]"/>

    <!-- Administrator -->
    <administrators id="22f34716-3b77-4e63-809d-35f9a4758011"/>

    <!-- User -->
    <users id="ba537227-d54f-42b3-aa58-10492cddf8a6"
           login="adimnUser2"
           password="$2a$12$bOPVAvWOC2f9gJoF37IeE.N9Ij15GfWeVlvHzDPTOJk66NimJMJ4."
           login_attempts="0"
           blocked="false"
           verified="true"
           language="EN"
           version="0"
           created_at="[NOW]"
           modified_at="[NOW]"
           active="true"/>

    <!-- Personal Data -->
    <personal_data user_id="ba537227-d54f-42b3-aa58-10492cddf8a6"
                   email="adimnUser2@test.com"
                   temp_email="[NULL]"
                   first_name="User"
                   last_name="Owner"/>

    <!-- Access Level -->
    <access_levels active="true"
                   version="0"
                   id="22f34716-3b77-4e63-809d-35f9a4758012"
                   user_id="ba537227-d54f-42b3-aa58-10492cddf8a6"
                   level="ADMINISTRATOR"
                   created_at="[NOW]"
                   modified_at="[NOW]"
                   created_by="[NULL]"
                   modified_by="[NULL]"/>

    <!-- Administrator -->
    <administrators id="22f34716-3b77-4e63-809d-35f9a4758012"/>

    <!-- Access Level -->
    <access_levels active="true"
                   version="0"
                   id="22f34716-3b77-4e63-809d-35f9a4758013"
                   user_id="ba537227-d54f-42b3-aa58-10492cddf8a6"
                   level="TENANT"
                   created_at="[NOW]"
                   modified_at="[NOW]"
                   created_by="[NULL]"
                   modified_by="[NULL]"/>

    <!-- Tenant -->
    <tenants id="22f34716-3b77-4e63-809d-35f9a4758013"/>

    <!-- User -->
    <users id="ba537227-d54f-42b3-aa58-10492cddf8a7"
           login="user"
           password="$2a$12$bOPVAvWOC2f9gJoF37IeE.N9Ij15GfWeVlvHzDPTOJk66NimJMJ4."
           login_attempts="0"
           blocked="false"
           verified="true"
           language="EN"
           version="0"
           created_at="[NOW]"
           modified_at="[NOW]"
           active="true"/>

    <!-- Personal Data -->
    <personal_data user_id="ba537227-d54f-42b3-aa58-10492cddf8a7"
                   email="user@test.com"
                   temp_email="[NULL]"
                   first_name="User"
                   last_name="User"/>
</dataset>