<dataset xmlns:xsi="http://www.w3.org/2001/XMLSchema-instance"
         xsi:noNamespaceSchemaLocation="userSchema.xsd">

    <!-- Administrator -->
    <users id="ba537227-d54f-42b3-aa58-10492cddf8a6"
           login="adminUser"
           password="$2a$12$bOPVAvWOC2f9gJoF37IeE.N9Ij15GfWeVlvHzDPTOJk66NimJMJ4."
           login_attempts="0"
           last_successful_login="2024-05-04 14:33:01.413581"
           last_failed_login="2024-05-04 14:33:01.413581"
           last_successful_login_ip="[NULL]"
           last_failed_login_ip="[NULL]"
           blocked="false"
           verified="true"
           language="EN"
           version="0"
           created_at="[NOW]"/>

    <!-- Personal Data -->
    <personal_data user_id="ba537227-d54f-42b3-aa58-10492cddf8a6"
                   email="adminUser@test.com"
                   first_name="AdminUser"
                   last_name="AdminUser"/>

    <!-- Access Level -->
    <access_levels active="true"
                   version="0"
                   id="22f34716-3b77-4e63-809d-35f9a4758011"
                   user_id="ba537227-d54f-42b3-aa58-10492cddf8a6"
                   level="ADMINISTRATOR"/>

    <!-- Administrator -->
    <administrators id="22f34716-3b77-4e63-809d-35f9a4758011"/>

    <!-- Unblocked and Verified User -->
    <users id="2d1c91e8-cc0c-4f33-ae6e-20a9948a6f2d"
           login="user"
           password="$2a$12$bOPVAvWOC2f9gJoF37IeE.N9Ij15GfWeVlvHzDPTOJk66NimJMJ4."
           login_attempts="0"
           last_successful_login="2024-05-04 14:33:01.413581"
           last_failed_login="2024-05-04 14:33:01.413581"
           last_successful_login_ip="[NULL]"
           last_failed_login_ip="[NULL]"
           blocked="false"
           verified="true"
           language="EN"
           version="0"
           created_at="[NOW]"/>

    <!-- Personal Data -->
    <personal_data user_id="2d1c91e8-cc0c-4f33-ae6e-20a9948a6f2d"
                   email="user@test.com"
                   first_name="User"
                   last_name="User"/>

    <!-- Access Level -->
    <access_levels active="true"
                   version="0"
                   id="22f34716-3b77-4e63-809d-35f9a4758012"
                   user_id="2d1c91e8-cc0c-4f33-ae6e-20a9948a6f2d"
                   level="TENANT"/>

    <!-- Tenant -->
    <tenants id="22f34716-3b77-4e63-809d-35f9a4758012"/>

    <!-- Tenant (Blocked) -->
    <users id="3a9a32e2-0f9e-4edf-b1ed-0e01386d6e49"
           login="blockedUser"
           password="$2a$12$bOPVAvWOC2f9gJoF37IeE.N9Ij15GfWeVlvHzDPTOJk66NimJMJ4."
           login_attempts="0"
           last_successful_login="2024-05-04 14:33:01.413581"
           last_failed_login="2024-05-04 14:33:01.413581"
           last_successful_login_ip="[NULL]"
           last_failed_login_ip="[NULL]"
           blocked="true"
           verified="true"
           language="EN"
           version="0"
           created_at="[NOW]"/>

    <!-- Personal Data -->
    <personal_data user_id="3a9a32e2-0f9e-4edf-b1ed-0e01386d6e49"
                   email="blockedUser@test.com"
                   first_name="Blocked"
                   last_name="User"/>

    <!-- Access Level -->
    <access_levels active="true"
                   version="0"
                   id="22f34716-3b77-4e63-809d-35f9a4758013"
                   user_id="3a9a32e2-0f9e-4edf-b1ed-0e01386d6e49"
                   level="TENANT"/>

    <tenants id="22f34716-3b77-4e63-809d-35f9a4758013"/>
</dataset>
